{
  "mode": "credentials",
  "credential_keys": [
    "DATABASE_URL",
    "REDIS_URL"
  ],
  "secrets_dir": "/private/var/run/dotenvx/myapp",
  "sockets": {
    "DATABASE_URL": "/private/var/run/dotenvx-credd/myapp/DATABASE_URL.sock",
    "REDIS_URL": "/private/var/run/dotenvx-credd/myapp/REDIS_URL.sock"
  },
  "verify_ramdisk": "/private/var/run/dotenvx"
}
